{
  "manifestApiVersion": "v2.0.0",
  "skillPackageId": "7b4cd571-dbe8-4acd-b958-ee220ec2afab",
  "manifestId": "ad99085a-dde0-4c29-bcee-9b0c49d785f5",
  "skillName": "web.search",
  "skillVersion": "1.0.0",
  "description": "Search the public web for a topic and return a compact list of relevant results with titles, URLs, and snippets.",
  "tags": [
    "search",
    "internet",
    "retrieval"
  ],
  "permissions": {
    "secrets": [
      "BING_API_KEY"
    ],
    "egress": "internet"
  },
  "skillDirectives": "You are the Web Search skill. Given a user query, call the search tool to retrieve the most relevant results.\nReturn a compact JSON object:\n  { \"results\": [ { \"title\": \"...\", \"url\": \"...\", \"snippet\": \"...\" } ], \"query_used\": \"<final query>\" }\n- Prefer high-authority sources and deduplicate near-duplicates.\n- Keep 'results' to ~5 items unless asked otherwise.",
  "requiredTools": [
    {
      "toolName": "search_bing",
      "description": "Searches the public web and returns top matching results.",
      "json_schema": {
        "name": "search_bing",
        "description": "Search the web for a query.",
        "parameters": {
          "type": "object",
          "properties": {
            "query": {
              "type": "string",
              "description": "Search query"
            },
            "top_k": {
              "type": "integer",
              "description": "Maximum results to return",
              "minimum": 1,
              "default": 5
            },
            "recency_days": {
              "type": "integer",
              "description": "Bias to documents from the last N days",
              "minimum": 1
            }
          },
          "required": [
            "query"
          ]
        },
        "type": "function",
        "required": []
      },
      "definition": {
        "type": "registered",
        "platformToolId": "TOOL_ID_SEARCH_BING_REPLACE_ME"
      }
    }
  ],
  "requiredDataSources": []
}