{
  "manifestApiVersion": "v2.0.0",
  "manifestId": "skill.research.news@0.1.0",
  "skillPackageId": null,
  "skillName": "research.news",
  "skillVersion": "0.1.0",
  "description": "Collects topical headlines and supporting web snippets",
  "tags": [
    "research",
    "news"
  ],
  "permissions": {
    "egress": "internet",
    "secrets": []
  },
  "skillDirectives": "Return at least three diverse sources when available; include source attribution.",
  "requiredTools": [
    {
      "toolName": "news_headlines",
      "description": "Pull relevant headlines",
      "json_schema": {
        "name": "news_headlines",
        "description": "Pull relevant headlines",
        "parameters": {
          "type": "object",
          "properties": {},
          "required": []
        }
      },
      "definition": {
        "type": "mcp_server",
        "serverId": "search",
        "toolName": "news_headlines"
      },
      "required": true
    },
    {
      "toolName": "web_fetch",
      "description": "Optional deep-dive on selected headline",
      "json_schema": {
        "name": "web_fetch",
        "description": "Optional deep-dive on selected headline",
        "parameters": {
          "type": "object",
          "properties": {},
          "required": []
        }
      },
      "definition": {
        "type": "mcp_server",
        "serverId": "web",
        "toolName": "web_fetch"
      },
      "required": false
    }
  ],
  "requiredDataSources": []
}