{
  "manifestApiVersion": "v2.0.0",
  "manifestId": "skill.plan.actions@0.1.0",
  "skillPackageId": null,
  "skillName": "plan.actions",
  "skillVersion": "0.1.0",
  "description": "Generates prioritized action plans",
  "tags": [
    "plan",
    "actions"
  ],
  "permissions": {
    "egress": "none",
    "secrets": []
  },
  "skillDirectives": "Output 3-5 actionable next steps ranked by impact.",
  "requiredTools": [
    {
      "toolName": "llm_action_plan",
      "description": "Generate prioritized actions",
      "json_schema": {
        "name": "llm_action_plan",
        "description": "Generate prioritized actions",
        "parameters": {
          "type": "object",
          "properties": {},
          "required": []
        }
      },
      "definition": {
        "type": "mcp_server",
        "serverId": "llm",
        "toolName": "llm_action_plan"
      },
      "required": true
    }
  ],
  "requiredDataSources": []
}