{
  "manifestApiVersion": "v2.0.0",
  "manifestId": "skill.research.web@0.1.0",
  "skillPackageId": null,
  "skillName": "research.web",
  "skillVersion": "0.1.0",
  "description": "Lightweight web research capability",
  "tags": [
    "research",
    "web"
  ],
  "permissions": {
    "egress": "internet",
    "secrets": []
  },
  "skillDirectives": "Follow queries precisely; extract key facts; provide citations.",
  "requiredTools": [
    {
      "toolName": "search.query",
      "description": "Core search tool",
      "json_schema": {
        "name": "search.query",
        "description": "Core search tool",
        "parameters": {
          "type": "object",
          "properties": {},
          "required": []
        }
      },
      "definition": {
        "type": "mcp_server",
        "serverId": "search",
        "toolName": "search.query"
      },
      "required": true
    },
    {
      "toolName": "web.fetch",
      "description": "Get page content",
      "json_schema": {
        "name": "web.fetch",
        "description": "Get page content",
        "parameters": {
          "type": "object",
          "properties": {},
          "required": []
        }
      },
      "definition": {
        "type": "mcp_server",
        "serverId": "web",
        "toolName": "web.fetch"
      },
      "required": true
    }
  ],
  "requiredDataSources": []
}