{
  "manifestApiVersion": "v2.0.0",
  "manifestId": "skill.write.summary@0.1.0",
  "skillPackageId": null,
  "skillName": "write.summary",
  "skillVersion": "0.1.0",
  "description": "Short factual summary writer",
  "tags": [
    "write",
    "summary"
  ],
  "permissions": {
    "egress": "none",
    "secrets": []
  },
  "skillDirectives": "Write concise, factual summaries (<150w), no speculation.",
  "requiredTools": [
    {
      "toolName": "llm_summarize",
      "description": "Summarize input text",
      "json_schema": {
        "name": "llm_summarize",
        "description": "Summarize input text",
        "parameters": {
          "type": "object",
          "properties": {},
          "required": []
        }
      },
      "definition": {
        "type": "mcp_server",
        "serverId": "llm",
        "toolName": "llm_summarize"
      },
      "required": true
    }
  ],
  "requiredDataSources": []
}