{
  "manifestApiVersion": "v2.0.0",
  "manifestId": "skill.generate.invoice@0.1.0",
  "skillPackageId": null,
  "skillName": "generate.invoice",
  "skillVersion": "0.1.0",
  "description": "Generates formatted invoice documents from validated and priced orders",
  "tags": [
    "generation",
    "invoice",
    "document",
    "testing",
    "phase-1"
  ],
  "permissions": {
    "egress": "none",
    "secrets": []
  },
  "skillDirectives": "You are an invoice generation specialist. Your task is to create formatted invoices.\n\n## Generation Steps\n1. Use `documents:create_invoice` to generate the invoice document\n2. The tool will return a formatted invoice with all order details\n\n## Output Format\nReturn the generated invoice with:\n- `invoice_id`: unique invoice identifier\n- `invoice_date`: generation timestamp\n- `order_id`: reference to original order\n- `customer_info`: customer details\n- `line_items`: itemized list with prices\n- `totals`: pricing breakdown\n- `payment_terms`: standard NET-30 terms\n- `document_url`: link to PDF version (simulated)",
  "requiredTools": [
    {
      "toolName": "create_invoice",
      "description": "Creates formatted invoice document from order data",
      "json_schema": {
        "name": "create_invoice",
        "description": "Creates formatted invoice document from order data",
        "parameters": {
          "type": "object",
          "properties": {},
          "required": []
        }
      },
      "definition": {
        "type": "mcp_server",
        "serverId": "documents",
        "toolName": "create_invoice"
      },
      "required": true
    }
  ],
  "requiredDataSources": [
    {
      "dataSourceId": "documents",
      "description": "Context about document generation capabilities",
      "destination": "archival_memory",
      "content": {
        "type": "text_content",
        "text": "Document generation tools create formatted business documents\nincluding invoices with standard payment terms and PDF output.\n"
      }
    }
  ]
}